tweet_id,timestamp,source,text,expanded_urls,dog_type,dog_breed,img_url,retweet_count,favorite_count,rating
685943807276412928,2016-01-09 21:58:42+00:00,iphone,This is the newly formed pupper a capella group. They're just starting out but I see tons of potential. 8/10 for all https://t.co/wbAcvFoNtn,https://twitter.com/dog_rates/status/685943807276412928/video/1,pupper,papillon,https://pbs.twimg.com/ext_tw_video_thumb/685943751555051520/pu/img/rlBvQWaFPUMx1MTi.jpg,546,1529,0.8
685663452032069632,2016-01-09 03:24:40+00:00,iphone,"Meet Brooks. He's confused by the almighty ball of tennis. 12/10 

(vid by @PDolan37) https://t.co/AcVWe39nmM",https://twitter.com/dog_rates/status/685663452032069632/video/1,unknown,chesapeake_bay_retriever,https://pbs.twimg.com/ext_tw_video_thumb/685663358637486080/pu/img/3cXSHFZAgJQ_dDCf.jpg,1362,3024,1.2
685641971164143616,2016-01-09 01:59:19+00:00,iphone,This is Otis. He just passed a cop while going 61 in a 45. Very nervous pupper. 7/10 https://t.co/jJS8qQeuNO,https://twitter.com/dog_rates/status/685641971164143616/photo/1,pupper,lakeland_terrier,https://pbs.twimg.com/media/CYPjvFqW8AAgiP2.jpg,705,2733,0.7
685325112850124800,2016-01-08 05:00:14+00:00,iphone,"""Tristan do not speak to me with that kind of tone or I will take away the Xbox."" 10/10 https://t.co/VGPH0TfESw",https://twitter.com/dog_rates/status/685325112850124800/photo/1,unknown,golden_retriever,https://pbs.twimg.com/media/CYLDikFWEAAIy1y.jpg,3655,8830,1.0
685321586178670592,2016-01-08 04:46:13+00:00,iphone,This is Rocky. He sleeps like a psychopath. 10/10 quality tongue slip https://t.co/MbgG95mUdu,https://twitter.com/dog_rates/status/685321586178670592/photo/1,unknown,boston_bull,https://pbs.twimg.com/media/CYLAWFMWMAEcRzb.jpg,588,2496,1.0
685307451701334016,2016-01-08 03:50:03+00:00,iphone,Say hello to Petrick. He's an Altostratus Floofer. Just had a run in with a trash bag. Groovy checkered floor. 11/10 https://t.co/rwW7z1JAOF,https://twitter.com/dog_rates/status/685307451701334016/photo/1,floofer,pomeranian,https://pbs.twimg.com/media/CYKzfTTWMAEeTN7.jpg,406,1956,1.1
685268753634967552,2016-01-08 01:16:17+00:00,iphone,This is Hubertson. He's a Carmel Haberdashery. Enjoys long summer days on his boat. Very peaceful pupper. 10/10 https://t.co/vzCl35fKlZ,https://twitter.com/dog_rates/status/685268753634967552/photo/1,pupper,pug,https://pbs.twimg.com/media/CYKQS0xUQAEOptC.jpg,1099,2908,1.0
685169283572338688,2016-01-07 18:41:01+00:00,iphone,Meet Gerbald. He just found out he's adopted. Poor pupper. Snazzy tongue tho. 11/10 would hold close in time of need https://t.co/UfGkB9Wrud,https://twitter.com/dog_rates/status/685169283572338688/photo/1,pupper,bernese_mountain_dog,https://pbs.twimg.com/media/CYI10WhWsAAjzii.jpg,1311,3858,1.1
684940049151070208,2016-01-07 03:30:07+00:00,iphone,This is Oreo. She's a photographer and a model. Living a double pupple life. 12/10 such talent much cute would pet https://t.co/zNeLxJeAoL,"https://twitter.com/dog_rates/status/684940049151070208/photo/1,https://twitter.com/dog_rates/status/684940049151070208/photo/1",unknown,border_collie,https://pbs.twimg.com/media/CYFlVUFWwAAEsWX.jpg,961,3005,1.2
684926975086034944,2016-01-07 02:38:10+00:00,iphone,Meet Bruiser &amp; Charlie. They are the best of pals. Been through it all together. Both 11/10. 1 like=1 friendship https://t.co/PEXHuvSVD4,https://twitter.com/dog_rates/status/684926975086034944/photo/1,unknown,labrador_retriever,https://pbs.twimg.com/media/CYFZXdiU0AAc_kw.jpg,428,3286,1.1
684902183876321280,2016-01-07 00:59:40+00:00,iphone,This is Perry. He's an Augustus Gloopster. Very condescending. Makes up for it with the sneaky tongue slip. 11/10 https://t.co/JVvIrUmTkR,https://twitter.com/dog_rates/status/684902183876321280/photo/1,unknown,pembroke,https://pbs.twimg.com/media/CYFC5lmWAAAEIho.jpg,482,1753,1.1
684800227459624960,2016-01-06 18:14:31+00:00,iphone,Meet Theodore. He's dapper as hell. Probably owns horses. Uses 'summer' as a verb. Often quotes philosophers. 11/10 https://t.co/J3Ld4fRbSy,https://twitter.com/dog_rates/status/684800227459624960/photo/1,unknown,miniature_schnauzer,https://pbs.twimg.com/media/CYDmK7ZVAAI_ylL.jpg,926,2558,1.1
684594889858887680,2016-01-06 04:38:35+00:00,iphone,"""FOR THE LAST TIME I DON'T WANNA PLAY TWISTER ALL THE SPOTS ARE GREY DAMN IT CINDY"" ...10/10 https://t.co/uhQNehTpIu",https://twitter.com/dog_rates/status/684594889858887680/photo/1,unknown,weimaraner,https://pbs.twimg.com/media/CYAra7JWsAACPZH.jpg,3243,8356,1.0
684481074559381504,2016-01-05 21:06:19+00:00,iphone,Meet Pippa. She's an Elfin High Feta. Compact af. Easy to transport. Great for vacations. 10/10 would keep in pocket https://t.co/nBtDeZ4yAb,https://twitter.com/dog_rates/status/684481074559381504/photo/1,unknown,chihuahua,https://pbs.twimg.com/media/CX_D6AJWwAAnBIw.jpg,1095,3645,1.0
684460069371654144,2016-01-05 19:42:51+00:00,iphone,This is Jeph. He's a Western Sagittarius Dookmarriot. Frightened by leaf. Caught him off guard. 10/10 calm down Jeph https://t.co/bicyOV6lju,https://twitter.com/dog_rates/status/684460069371654144/photo/1,unknown,labrador_retriever,https://pbs.twimg.com/media/CX-wzZEUwAA4ISM.jpg,515,1858,1.0
684241637099323392,2016-01-05 05:14:53+00:00,iphone,This is Obi. He got camera shy. 12/10 https://t.co/feiPiq7z94,"https://twitter.com/dog_rates/status/684241637099323392/photo/1,https://twitter.com/dog_rates/status/684241637099323392/photo/1,https://twitter.com/dog_rates/status/684241637099323392/photo/1",unknown,pembroke,https://pbs.twimg.com/media/CX7qIcdWcAELJ7N.jpg,3011,7620,1.2
684188786104872960,2016-01-05 01:44:52+00:00,iphone,"""Yo Boomer I'm taking a selfie, grab your stick""
""Ok make sure to get this rad hole I just dug in there""

Both 10/10 https://t.co/e0gbl9VFpA",https://twitter.com/dog_rates/status/684188786104872960/photo/1,unknown,kelpie,https://pbs.twimg.com/media/CX66EiJWkAAVjA-.jpg,1078,3290,1.0
684177701129875456,2016-01-05 01:00:50+00:00,iphone,This is Kulet. She's very proud of the flower she picked. Loves it dearly. 10/10 now I want a flower https://t.co/myUUwqJIs7,https://twitter.com/dog_rates/status/684177701129875456/photo/1,unknown,chow,https://pbs.twimg.com/media/CX6v_JOWsAE0beZ.jpg,606,1897,1.0
683852578183077888,2016-01-04 03:28:54+00:00,iphone,"Say hello to Tiger. He's a penbroke (little dog pun for ya, no need to applaud I know it was good) 10/10 good dog https://t.co/Yei0HzS3JN",https://twitter.com/dog_rates/status/683852578183077888/photo/1,unknown,toy_poodle,https://pbs.twimg.com/media/CX2ISqSWYAAEtCF.jpg,323,1823,1.0
683481228088049664,2016-01-03 02:53:17+00:00,iphone,Meet Banjo. He's a Peppercorn Shoop Da Whoop. Nails look lethal. Skeptical of luminescent orb 11/10 stay woke pupper https://t.co/H7NZFumpKq,https://twitter.com/dog_rates/status/683481228088049664/photo/1,pupper,keeshond,https://pbs.twimg.com/media/CXw2jSpWMAAad6V.jpg,925,2508,1.1
683462770029932544,2016-01-03 01:39:57+00:00,iphone,"""Hello forest pupper I am house pupper welcome to my abode"" (8/10 for both) https://t.co/qFD8217fUT",https://twitter.com/dog_rates/status/683462770029932544/photo/1,pupper,italian_greyhound,https://pbs.twimg.com/media/CXwlw9MWsAAc-JB.jpg,632,2280,0.8
683357973142474752,2016-01-02 18:43:31+00:00,iphone,"""Have a seat, son. There are some things we need to discuss"" 10/10 https://t.co/g4G5tvfTVd",https://twitter.com/dog_rates/status/683357973142474752/photo/1,unknown,pembroke,https://pbs.twimg.com/media/CXvGbWeWMAcRbyJ.jpg,843,2724,1.0
683142553609318400,2016-01-02 04:27:31+00:00,iphone,Meet Brandy. She's a member of the Bloods. Menacing criminal pupper. Soft spot for flowers tho. 9/10 pet w caution https://t.co/hhIA3coiAJ,https://twitter.com/dog_rates/status/683142553609318400/photo/1,pupper,leonberg,https://pbs.twimg.com/media/CXsChyjW8AQJ16C.jpg,965,2690,0.9
683111407806746624,2016-01-02 02:23:45+00:00,iphone,This is Larry. He thought the New Year's parties were tonight. 10/10 poor pupper. Maybe next year https://t.co/h3X0jK8MVM,https://twitter.com/dog_rates/status/683111407806746624/photo/1,pupper,cocker_spaniel,https://pbs.twimg.com/media/CXrmMSpUwAAdeRj.jpg,838,3198,1.0
683030066213818368,2016-01-01 21:00:32+00:00,iphone,This is Lulu. She's contemplating all her unreached 2015 goals and daydreaming of a more efficient tomorrow. 10/10 https://t.co/h3ScYuz77J,https://twitter.com/dog_rates/status/683030066213818368/photo/1,unknown,boxer,https://pbs.twimg.com/media/CXqcOHCUQAAugTB.jpg,689,2033,1.0
682429480204398592,2015-12-31 05:14:01+00:00,iphone,"I know we joke around on here, but this is getting really frustrating. We rate dogs. Not T-Rex. Thank you... 8/10 https://t.co/5aFw7SWyxU",https://twitter.com/dog_rates/status/682429480204398592/photo/1,unknown,whippet,https://pbs.twimg.com/media/CXh5_dDWQAIbU-J.jpg,1068,3232,0.8
682032003584274432,2015-12-30 02:54:35+00:00,iphone,This is Ulysses. He likes holding hands and his eyes are magic. 11/10 https://t.co/gPmJHmtgak,https://twitter.com/dog_rates/status/682032003584274432/photo/1,unknown,schipperke,https://pbs.twimg.com/media/CXcQfUNUQAEwFoQ.jpg,1848,6175,1.1
681981167097122816,2015-12-29 23:32:35+00:00,iphone,This is Jimothy. He's a Trinidad Poliwhirl. Father was a velociraptor. Exceptionally unamused. 12/10 would adopt https://t.co/VwdIk0OwVx,https://twitter.com/dog_rates/status/681981167097122816/photo/1,unknown,labrador_retriever,https://pbs.twimg.com/media/CXbiQHmWcAAt6Lm.jpg,944,2640,1.2
681654059175129088,2015-12-29 01:52:46+00:00,iphone,This is Toffee. He's a happy pupper. Appears dangerously fluffy. Extraordinarily spherical. 12/10 would pet firmly https://t.co/oEXEKt3MHu,https://twitter.com/dog_rates/status/681654059175129088/photo/1,pupper,pomeranian,https://pbs.twimg.com/media/CXW4wGHWsAE_eBD.jpg,837,2464,1.2
681610798867845120,2015-12-28 23:00:52+00:00,iphone,*collapses* 12/10 https://t.co/C7M8mnzHIK,https://twitter.com/dog_rates/status/681610798867845120/photo/1,unknown,toy_poodle,https://pbs.twimg.com/media/CXWRZBgWkAEHMea.jpg,431,1773,1.2
681579835668455424,2015-12-28 20:57:50+00:00,iphone,This is Apollo. He thought you weren't coming back so he had a mental breakdown. 8/10 we've all been there https://t.co/ojUBrDCHLT,https://twitter.com/dog_rates/status/681579835668455424/photo/1,unknown,rottweiler,https://pbs.twimg.com/media/CXV1Ot_W8AEpkQO.jpg,1202,3319,0.8
681523177663676416,2015-12-28 17:12:42+00:00,iphone,This is Carly. She's actually 2 dogs fused together. Very innovative. Probably has superpowers. 12/10 for double dog https://t.co/GQn2IopLud,https://twitter.com/dog_rates/status/681523177663676416/photo/1,unknown,norfolk_terrier,https://pbs.twimg.com/media/CXVBtX_WwAEuqbP.jpg,5312,13387,1.2
681297372102656000,2015-12-28 02:15:26+00:00,iphone,"This is actually a lion. We only rate dogs. For the last time please only send dogs. Thank u.
12/10 would still pet https://t.co/Pp26dMQxap",https://twitter.com/dog_rates/status/681297372102656000/photo/1,unknown,lhasa,https://pbs.twimg.com/media/CXR0WJ_W8AMd_O8.jpg,879,3016,1.2
681281657291280384,2015-12-28 01:12:59+00:00,iphone,Meet Sarge. His parents signed him up for dancing lessons but his true passion is roller coasters 11/10 very petable https://t.co/KvVoBIgkje,https://twitter.com/dog_rates/status/681281657291280384/photo/1,unknown,saint_bernard,https://pbs.twimg.com/media/CXRmDfWWMAADCdc.jpg,1018,3037,1.1
681231109724700672,2015-12-27 21:52:07+00:00,iphone,I just love this pic. 11/10 this pupper is going places https://t.co/P16uhh1PbI,https://twitter.com/dog_rates/status/681231109724700672/photo/1,pupper,irish_setter,https://pbs.twimg.com/media/CXQ4EwQWwAEVaUf.jpg,455,2271,1.1
680970795137544192,2015-12-27 04:37:44+00:00,iphone,I thought I made this very clear. We only rate dogs. Stop sending other things like this shark. Thank you... 9/10 https://t.co/CXSJZ4Stk3,https://twitter.com/dog_rates/status/680970795137544192/photo/1,unknown,pug,https://pbs.twimg.com/media/CXNLU6wWkAE0OkJ.jpg,601,2260,0.9
680934982542561280,2015-12-27 02:15:25+00:00,iphone,Say hello to Sadie. She's a Tortellini Sidewinder. Very jubilant pup. Seems loyal. Leaves on point. 10/10 petable af https://t.co/g2bTu4ayPl,https://twitter.com/dog_rates/status/680934982542561280/photo/1,unknown,labrador_retriever,https://pbs.twimg.com/media/CXMqwIQWcAA2iE0.jpg,404,1954,1.0
680913438424612864,2015-12-27 00:49:49+00:00,iphone,Meet Griswold. He's dapper as hell. Already pumped for next Christmas. 11/10 https://t.co/5NrpNDyFzN,https://twitter.com/dog_rates/status/680913438424612864/photo/1,unknown,pomeranian,https://pbs.twimg.com/media/CXMXKKHUMAA1QN3.jpg,571,2258,1.1
680889648562991104,2015-12-26 23:15:17+00:00,iphone,This is Cheesy. It's her birthday. She's patiently waiting to eat her party muffin. 9/10 happy birthday pup https://t.co/cH2H7mch2H,https://twitter.com/dog_rates/status/680889648562991104/photo/1,unknown,shetland_sheepdog,https://pbs.twimg.com/media/CXMBhXfWEAA4mMI.jpg,335,1647,0.9
680836378243002368,2015-12-26 19:43:36+00:00,iphone,This is Ellie. She's secretly ferocious. 12/10 very deadly pupper https://t.co/BF4BW8LUgb,"https://twitter.com/dog_rates/status/680836378243002368/photo/1,https://twitter.com/dog_rates/status/680836378243002368/photo/1,https://twitter.com/dog_rates/status/680836378243002368/photo/1",pupper,pembroke,https://pbs.twimg.com/media/CXLREjOW8AElfk6.jpg,1219,3232,1.2
680801747103793152,2015-12-26 17:25:59+00:00,iphone,Great picture here. Dog on the right panicked &amp; forgot about his tongue. Middle green dog must've fainted. All 10/10 https://t.co/31npKUAox0,https://twitter.com/dog_rates/status/680801747103793152/photo/1,unknown,pug,https://pbs.twimg.com/media/CXKxkseW8AAjAMY.jpg,757,2231,1.0
680497766108381184,2015-12-25 21:18:05+00:00,iphone,Meet Percy. He's a Latvian Yuletide Heineken. Refuses to take off sweater. Kinda feisty. 12/10 would keep in pocket https://t.co/QGM5Fcuv7s,https://twitter.com/dog_rates/status/680497766108381184/photo/1,unknown,chihuahua,https://pbs.twimg.com/media/CXGdG0aWcAEbOO1.jpg,1774,3953,1.2
680145970311643136,2015-12-24 22:00:10+00:00,iphone,Say hello to Kawhi. He was doing fine until his hat fell off. He got it back though. 10/10 deep breaths pupper https://t.co/N5pM6WBx7e,"https://twitter.com/dog_rates/status/680145970311643136/photo/1,https://twitter.com/dog_rates/status/680145970311643136/photo/1,https://twitter.com/dog_rates/status/680145970311643136/photo/1",pupper,miniature_poodle,https://pbs.twimg.com/media/CXBdJxLUsAAWql2.jpg,1602,3391,1.0
680100725817409536,2015-12-24 19:00:23+00:00,tweetdeck,This pupper is not coming inside until she catches a snowflake on her tongue. 11/10 the determination is palpable https://t.co/lvMYbmKq8H,https://twitter.com/dog_rates/status/680100725817409536/photo/1,pupper,golden_retriever,https://pbs.twimg.com/media/CW-loUBWYAAn2Cb.jpg,1275,3364,1.1
679828447187857408,2015-12-24 00:58:27+00:00,iphone,Everybody look at this beautiful pupper 13/10 https://t.co/hyAC5Hq9GC,"https://twitter.com/dog_rates/status/679828447187857408/photo/1,https://twitter.com/dog_rates/status/679828447187857408/photo/1,https://twitter.com/dog_rates/status/679828447187857408/photo/1",pupper,chihuahua,https://pbs.twimg.com/media/CW88XN4WsAAlo8r.jpg,12875,33798,1.3
679777920601223168,2015-12-23 21:37:40+00:00,iphone,This is Rinna. She's melting. 10/10 get inside pupper https://t.co/PA0czwucsb,https://twitter.com/dog_rates/status/679777920601223168/photo/1,pupper,bloodhound,https://pbs.twimg.com/media/CW8OYajUMAAPRoF.jpg,1012,2907,1.0
679736210798047232,2015-12-23 18:51:56+00:00,iphone,This pup's name is Sabertooth (parents must be cool). Ears for days. Jumps unannounced. 9/10 would pet diligently https://t.co/iazoiNUviP,https://twitter.com/dog_rates/status/679736210798047232/photo/1,unknown,french_bulldog,https://pbs.twimg.com/media/CW7oelWWcAAhyzz.jpg,730,1954,0.9
679722016581222400,2015-12-23 17:55:32+00:00,iphone,This is Mike. He is a Jordanian Frito Pilates. Frowning because he can't see directly in front of him. 8/10 https://t.co/NL5QJwdEpF,https://twitter.com/dog_rates/status/679722016581222400/photo/1,unknown,boxer,https://pbs.twimg.com/media/CW7bkW6WQAAksgB.jpg,434,1564,0.8
679511351870550016,2015-12-23 03:58:25+00:00,iphone,Say hello to William. He makes fun of others because he's terrified of his own deep-seated insecurities. 7/10 https://t.co/bwuV6FlRxr,https://twitter.com/dog_rates/status/679511351870550016/photo/1,unknown,chihuahua,https://pbs.twimg.com/media/CW4b-GUWYAAa8QO.jpg,1167,3134,0.7
679475951516934144,2015-12-23 01:37:45+00:00,iphone,This is Evy. She doesn't want to be a Koala. 9/10 https://t.co/VITeF0Kl9L,https://twitter.com/dog_rates/status/679475951516934144/photo/1,unknown,maltese_dog,https://pbs.twimg.com/media/CW37xZbUoAAUXe5.jpg,595,1959,0.9
679462823135686656,2015-12-23 00:45:35+00:00,iphone,Meet Hurley. He's the curly one. He hugs every other dog he sees during his walk. 11/10 for spreading the love https://t.co/M6vqkt2GKV,https://twitter.com/dog_rates/status/679462823135686656/photo/1,unknown,toy_poodle,https://pbs.twimg.com/media/CW3v1KxW8AAIOuy.jpg,17274,29388,1.1
679158373988876288,2015-12-22 04:35:49+00:00,iphone,This is Rubio. He has too much skin. 11/10 https://t.co/NLOHmlENag,https://twitter.com/dog_rates/status/679158373988876288/photo/1,unknown,pug,https://pbs.twimg.com/media/CWza7kpWcAAdYLc.jpg,7388,19785,1.1
679111216690831360,2015-12-22 01:28:25+00:00,iphone,This is officially the greatest yawn of all time. 12/10 https://t.co/4R0Cc0sLVE,https://twitter.com/dog_rates/status/679111216690831360/video/1,unknown,kelpie,https://pbs.twimg.com/ext_tw_video_thumb/679111114081370114/pu/img/hFca8BHjRopgD0cM.jpg,2374,5529,1.2
678969228704284672,2015-12-21 16:04:13+00:00,iphone,Meet Lola. She's a Metamorphic Chartreuse. Plays with her food. Insubordinate and churlish. Exquisite hardwood 11/10 https://t.co/etpBNXwN7f,https://twitter.com/dog_rates/status/678969228704284672/photo/1,unknown,labrador_retriever,https://pbs.twimg.com/media/CWwu6OLUkAEo3gq.jpg,420,1531,1.1
678800283649069056,2015-12-21 04:52:53+00:00,iphone,Here's a pupper with some mean tan lines. Snazzy sweater though 12/10 https://t.co/DpCSVsl6vu,https://twitter.com/dog_rates/status/678800283649069056/photo/1,pupper,labrador_retriever,https://pbs.twimg.com/media/CWuVQSLW4AAI3w9.jpg,831,2391,1.2
678798276842360832,2015-12-21 04:44:55+00:00,iphone,This is Linda. She fucking hates trees. 7/10 https://t.co/blaY85FIxR,https://twitter.com/dog_rates/status/678798276842360832/photo/1,unknown,airedale,https://pbs.twimg.com/media/CWuTbAKUsAAvZHh.jpg,1058,3215,0.7
678764513869611008,2015-12-21 02:30:45+00:00,iphone,"Meet Wilson. He got caught humping the futon. He's like ""dude, help me out here"" 10/10 I'd help Wilson out https://t.co/m6XoclB0qv",https://twitter.com/dog_rates/status/678764513869611008/photo/1,unknown,irish_terrier,https://pbs.twimg.com/media/CWt0ubZWcAAkFER.jpg,429,1511,1.0
678755239630127104,2015-12-21 01:53:54+00:00,iphone,This is Dash. He didn't think the water would be that cold. Damn it Dash it's December. Think a little. 10/10 https://t.co/NqcOwG8pxW,https://twitter.com/dog_rates/status/678755239630127104/photo/1,unknown,malamute,https://pbs.twimg.com/media/CWtsSQAUkAAnWws.jpg,2991,6596,1.0
678446151570427904,2015-12-20 05:25:42+00:00,iphone,Touching scene here. Really stirs up the emotions. The bond between father &amp; son. So beautiful. 10/10 for both pups https://t.co/AJWJHov5gx,https://twitter.com/dog_rates/status/678446151570427904/photo/1,unknown,staffordshire_bullterrier,https://pbs.twimg.com/media/CWpTLOYWsAEDhcU.jpg,1399,3725,1.0
678424312106393600,2015-12-20 03:58:55+00:00,iphone,This is Crystal. She's a shitty fireman. No sense of urgency. People could be dying Crystal. 2/10 just irresponsible https://t.co/rtMtjSl9pz,https://twitter.com/dog_rates/status/678424312106393600/photo/1,unknown,maltese_dog,https://pbs.twimg.com/media/CWo_T8gW4AAgJNo.jpg,2339,5082,0.2
678410210315247616,2015-12-20 03:02:53+00:00,iphone,Say hello to Jerome. He can shoot french fries out of his mouth at insane speeds. Deadly af. 10/10 https://t.co/dIy88HwrX8,https://twitter.com/dog_rates/status/678410210315247616/photo/1,unknown,schipperke,https://pbs.twimg.com/media/CWoyfMiWUAAmGdd.jpg,1643,3907,1.0
678396796259975168,2015-12-20 02:09:34+00:00,iphone,These little fellas have opposite facial expressions. Both 12/10 https://t.co/LmThv0GWen,"https://twitter.com/dog_rates/status/678396796259975168/photo/1,https://twitter.com/dog_rates/status/678396796259975168/photo/1",unknown,pembroke,https://pbs.twimg.com/media/CWomSU_XIAAUYiK.jpg,381,1483,1.2
678389028614488064,2015-12-20 01:38:42+00:00,iphone,"This is Bella. She just learned that her final grade in chem was a 92.49 
poor pupper 11/10 https://t.co/auOoKuoveM",https://twitter.com/dog_rates/status/678389028614488064/photo/1,pupper,miniature_pinscher,https://pbs.twimg.com/media/CWofOHUWUAACGVa.jpg,386,1735,1.1
678341075375947776,2015-12-19 22:28:09+00:00,iphone,This pupper likes tape. 12/10 https://t.co/cSp6w5GWgm,https://twitter.com/dog_rates/status/678341075375947776/photo/1,pupper,golden_retriever,https://pbs.twimg.com/media/CWnznDTU4AAa-6P.jpg,485,1600,1.2
678334497360859136,2015-12-19 22:02:01+00:00,iphone,This is Rosie. She has a snazzy bow tie and a fin for a tail. Probably super fast underwater. Cool socks 10/10 https://t.co/GO76MdGBs0,https://twitter.com/dog_rates/status/678334497360859136/photo/1,unknown,norfolk_terrier,https://pbs.twimg.com/media/CWntoDVWcAEl3NB.jpg,229,1201,1.0
678278586130948096,2015-12-19 18:19:51+00:00,iphone,Another spooky pupper here. Most definitely floating. No legs. Probably knows some dark magic. 10/10 very spooked https://t.co/JK8MByRzgj,https://twitter.com/dog_rates/status/678278586130948096/photo/1,pupper,maltese_dog,https://pbs.twimg.com/media/CWm6xySUEAAqfFU.jpg,5607,10615,1.0
678255464182861824,2015-12-19 16:47:58+00:00,iphone,This is Jessifer. She is a Bismoth Teriyaki. Flowers being attacked by hurricanes on bandana (rad). 9/10 stellar pup https://t.co/nZhmRwZzWv,https://twitter.com/dog_rates/status/678255464182861824/photo/1,unknown,chihuahua,https://pbs.twimg.com/media/CWmlvxJU4AEAqaN.jpg,337,1479,0.9
677918531514703872,2015-12-18 18:29:07+00:00,iphone,"""Everything looks pretty good in there. Make sure to brush your gums. Been flossing? How's school going?"" Both 10/10 https://t.co/lWL2IMJqLR",https://twitter.com/dog_rates/status/677918531514703872/photo/1,unknown,eskimo_dog,https://pbs.twimg.com/media/CWhzTbzWUAAEAUN.jpg,376,1244,1.0
677895101218201600,2015-12-18 16:56:01+00:00,iphone,Guys this was terrifying. Really spooked me up. We don't rate ghosts. We rate dogs. Please only send dogs... 9/10 https://t.co/EJImi1udYb,https://twitter.com/dog_rates/status/677895101218201600/photo/1,unknown,dalmatian,https://pbs.twimg.com/media/CWhd_7WWsAAaqWG.jpg,1888,4475,0.9
677547928504967168,2015-12-17 17:56:29+00:00,iphone,Not much to say here. I just think everyone needs to see this. 12/10 https://t.co/AGag0hFHpe,https://twitter.com/dog_rates/status/677547928504967168/photo/1,unknown,american_staffordshire_terrier,https://pbs.twimg.com/media/CWciPonWEAUOqLD.jpg,3365,6430,1.2
677530072887205888,2015-12-17 16:45:31+00:00,iphone,Say hello to Axel. He's a Black Chevy Pinot on wheels. 0 to 60 in 5.7 seconds (if downhill). 9/10 I call shotgun https://t.co/DKe9DBnnHE,https://twitter.com/dog_rates/status/677530072887205888/photo/1,unknown,staffordshire_bullterrier,https://pbs.twimg.com/media/CWcSAI-WUAAOB9W.jpg,209,985,0.9
677334615166730240,2015-12-17 03:48:51+00:00,iphone,This dog gave up mid jump. 9/10 https://t.co/KmMv3Y2zI8,"https://twitter.com/dog_rates/status/677334615166730240/photo/1,https://twitter.com/dog_rates/status/677334615166730240/photo/1",unknown,lakeland_terrier,https://pbs.twimg.com/media/CWZgPPUWUAAUOvu.jpg,257,1252,0.9
677331501395156992,2015-12-17 03:36:28+00:00,iphone,Meet Humphrey. He's a Northern Polyp Viagra. One ear works. Face stuck like that. Always surprised. 9/10 petable af https://t.co/FS7eJQM2F4,https://twitter.com/dog_rates/status/677331501395156992/photo/1,unknown,beagle,https://pbs.twimg.com/media/CWZdaGxXAAAjGjb.jpg,214,1003,0.9
677301033169788928,2015-12-17 01:35:24+00:00,iphone,This is Juckson. He's totally on his way to a nascar race. 5/10 for Juckson https://t.co/IoLRvF0Kak,https://twitter.com/dog_rates/status/677301033169788928/photo/1,unknown,japanese_spaniel,https://pbs.twimg.com/media/CWZBsjPWsAAZFFl.jpg,362,1134,0.5
677269281705472000,2015-12-16 23:29:14+00:00,iphone,This is the happiest pupper I've ever seen. 10/10 would trade lives with https://t.co/ep8ATEJwRb,https://twitter.com/dog_rates/status/677269281705472000/photo/1,pupper,shetland_sheepdog,https://pbs.twimg.com/media/CWYk0WxWoAAEwRt.jpg,650,1832,1.0
677187300187611136,2015-12-16 18:03:28+00:00,iphone,Here we see a Byzantine Rigatoni. Very aerodynamic. No eyes. Actually not windy here they just look like that. 9/10 https://t.co/gzI0m6wXRo,https://twitter.com/dog_rates/status/677187300187611136/photo/1,unknown,english_setter,https://pbs.twimg.com/media/CWXaQMBWcAAATDi.jpg,833,2529,0.9
676957860086095872,2015-12-16 02:51:45+00:00,iphone,10/10 I'd follow this dog into battle no questions asked https://t.co/ngTNXYQF0L,https://twitter.com/dog_rates/status/676957860086095872/video/1,unknown,labrador_retriever,https://pbs.twimg.com/ext_tw_video_thumb/676957802976419840/pu/img/dCj-qlXo73A5hf6Q.jpg,738,2071,1.0
676936541936185344,2015-12-16 01:27:03+00:00,iphone,Here we see a rare pouched pupper. Ample storage space. Looks alert. Jumps at random. Kicked open that door. 8/10 https://t.co/mqvaxleHRz,https://twitter.com/dog_rates/status/676936541936185344/photo/1,pupper,chesapeake_bay_retriever,https://pbs.twimg.com/media/CWT2MUgWIAECWig.jpg,4518,11816,0.8
