tweet_id,timestamp,source,text,expanded_urls,dog_type,dog_breed,img_url,retweet_count,favorite_count,rating
738402415918125056,2016-06-02 16:10:29+00:00,iphone,"""Don't talk to me or my son ever again"" ...10/10 for both https://t.co/s96OYXZIfK",https://twitter.com/dog_rates/status/738402415918125056/photo/1,unknown,cocker_spaniel,https://pbs.twimg.com/media/Cj9VEs_XAAAlTai.jpg,760,3058,1.0
738166403467907072,2016-06-02 00:32:39+00:00,iphone,This is Axel. He's a professional leaf catcher. 12/10 gifted af https://t.co/P8bgOMMTRs,"https://twitter.com/dog_rates/status/738166403467907072/photo/1,https://twitter.com/dog_rates/status/738166403467907072/photo/1,https://twitter.com/dog_rates/status/738166403467907072/photo/1,https://twitter.com/dog_rates/status/738166403467907072/photo/1",unknown,keeshond,https://pbs.twimg.com/media/Cj5-aUQUgAAb43p.jpg,3091,8231,1.2
737826014890496000,2016-06-01 02:00:04+00:00,iphone,This is Remy. He has some long ass ears (probably magical). Also very proud of broken stick. 10/10 such a good boy https://t.co/EZx0YjPjPK,"https://twitter.com/dog_rates/status/737826014890496000/photo/1,https://twitter.com/dog_rates/status/737826014890496000/photo/1",unknown,vizsla,https://pbs.twimg.com/media/Cj1I1fbWYAAOwff.jpg,1636,4934,1.0
737800304142471168,2016-06-01 00:17:54+00:00,iphone,This is Bella. She's ubering home after a few too many drinks. 10/10 socially conscious af https://t.co/KxkOgq80Xj,https://twitter.com/dog_rates/status/737800304142471168/photo/1,unknown,malamute,https://pbs.twimg.com/media/Cj0xdMBVAAEbDHp.jpg,3218,9422,1.0
737678689543020544,2016-05-31 16:14:39+00:00,iphone,We only rate dogs. Pls stop sending in non-canines like this Slovak Car Bunny. It makes my job very difficult. 11/10 https://t.co/VflvQLH2y5,https://twitter.com/dog_rates/status/737678689543020544/photo/1,unknown,pembroke,https://pbs.twimg.com/media/CjzC2oGWYAAyIfG.jpg,1224,4726,1.1
737445876994609152,2016-05-31 00:49:32+00:00,iphone,Just wanted to share this super rare Rainbow Floofer in case you guys haven't seen it yet. 13/10 colorful af https://t.co/CaG9MzD3WT,https://twitter.com/dog_rates/status/737445876994609152/photo/1,floofer,samoyed,https://pbs.twimg.com/media/CjvvHBwUoAE55WZ.jpg,4134,9630,1.3
736736130620620800,2016-05-29 01:49:16+00:00,iphone,This is Chadrick. He's gnarly af 13/10 https://t.co/447tyBN0mW,https://twitter.com/dog_rates/status/736736130620620800/photo/1,unknown,schipperke,https://pbs.twimg.com/media/CjlpmZaUgAED54W.jpg,1582,3962,1.3
736225175608430592,2016-05-27 15:58:54+00:00,iphone,We only rate dogs. Please stop sending in non-canines like this Alaskan Flop Turtle. This is very frustrating. 10/10 https://t.co/qXteK6Atxc,https://twitter.com/dog_rates/status/736225175608430592/photo/1,unknown,labrador_retriever,https://pbs.twimg.com/media/CjeY5DKXEAA3WkD.jpg,2593,7626,1.0
736010884653420544,2016-05-27 01:47:23+00:00,iphone,Right after you graduate vs when you remember you're on your own now and can barely work a washing machine ...10/10 https://t.co/O1TLuYjsNS,"https://twitter.com/dog_rates/status/736010884653420544/photo/1,https://twitter.com/dog_rates/status/736010884653420544/photo/1",unknown,golden_retriever,https://pbs.twimg.com/media/CjbV-lEWgAAr6WY.jpg,2748,7369,1.0
735991953473572864,2016-05-27 00:32:10+00:00,iphone,This is Maxaroni. He's curly af. Also rather fabulous. 11/10 would hug well https://t.co/A216OjIdca,"https://twitter.com/dog_rates/status/735991953473572864/photo/1,https://twitter.com/dog_rates/status/735991953473572864/photo/1,https://twitter.com/dog_rates/status/735991953473572864/photo/1",unknown,cocker_spaniel,https://pbs.twimg.com/media/CjbExRKUoAAs089.jpg,1049,3350,1.1
735648611367784448,2016-05-26 01:47:51+00:00,iphone,*faints* 12/10 perfection in pupper form https://t.co/t6TxTwTLEK,https://twitter.com/dog_rates/status/735648611367784448/photo/1,pupper,pembroke,https://pbs.twimg.com/media/CjWMezdW0AErwU3.jpg,1032,3798,1.2
735256018284875776,2016-05-24 23:47:49+00:00,iphone,This is Kellogg. He accidentally opened the front facing camera. 8/10 get it together doggo https://t.co/MRYv7nDPyS,https://twitter.com/dog_rates/status/735256018284875776/photo/1,doggo,staffordshire_bullterrier,https://pbs.twimg.com/media/CjQnclkVEAA4pnK.jpg,819,3130,0.8
734912297295085568,2016-05-24 01:02:00+00:00,iphone,This is Jax. He's a literal fluffball. Sneaky tongue slip. 10/10 would pet nonstop https://t.co/9MGouPwQmK,https://twitter.com/dog_rates/status/734912297295085568/photo/1,unknown,maltese_dog,https://pbs.twimg.com/media/CjLuzPvUoAAbU5k.jpg,488,2589,1.0
734787690684657664,2016-05-23 16:46:51+00:00,iphone,This dog is more successful than I will ever be. 13/10 absolute legend https://t.co/BPoaHySYwA,"https://twitter.com/dog_rates/status/734787690684657664/photo/1,https://twitter.com/dog_rates/status/734787690684657664/photo/1,https://twitter.com/dog_rates/status/734787690684657664/photo/1,https://twitter.com/dog_rates/status/734787690684657664/photo/1",unknown,golden_retriever,https://pbs.twimg.com/media/CjJ9gQ1WgAAXQtJ.jpg,5871,11770,1.3
734776360183431168,2016-05-23 16:01:50+00:00,iphone,This is Livvie. Someone should tell her it's been 47 years since Woodstock. Magical eyes tho 11/10 would stare into https://t.co/qw07vhVHuO,https://twitter.com/dog_rates/status/734776360183431168/photo/1,unknown,siberian_husky,https://pbs.twimg.com/media/CjJzMlBUoAADMLx.jpg,495,2363,1.1
733822306246479872,2016-05-21 00:50:46+00:00,iphone,This is Moose. He's a Polynesian Floofer. Dapper af. 10/10 would pet diligently https://t.co/mVfqRdppTL,https://twitter.com/dog_rates/status/733822306246479872/photo/1,floofer,lhasa,https://pbs.twimg.com/media/Ci8Pfg_UUAA2m9i.jpg,951,3454,1.0
733482008106668032,2016-05-20 02:18:32+00:00,iphone,"""Ello this is dog how may I assist"" ...10/10 https://t.co/jeAENpjH7L",https://twitter.com/dog_rates/status/733482008106668032/photo/1,unknown,french_bulldog,https://pbs.twimg.com/media/Ci3Z_idUkAA8RUh.jpg,866,2925,1.0
733109485275860992,2016-05-19 01:38:16+00:00,iphone,"Like father (doggo), like son (pupper). Both 12/10 https://t.co/pG2inLaOda",https://twitter.com/dog_rates/status/733109485275860992/photo/1,unknown,golden_retriever,https://pbs.twimg.com/media/CiyHLocU4AI2pJu.jpg,15815,50213,1.2
732726085725589504,2016-05-18 00:14:46+00:00,iphone,This is Aldrick. He looks wise af. Also exceptionally fluffy. Only two legs tho (unfortunate). 11/10 would still hug https://t.co/QwiCVLPMNL,https://twitter.com/dog_rates/status/732726085725589504/photo/1,unknown,pomeranian,https://pbs.twimg.com/media/CisqdVcXEAE3iW7.jpg,815,3347,1.1
732005617171337216,2016-05-16 00:31:53+00:00,iphone,This is Larry. He has no self control. Tongue still nifty af tho 11/10 https://t.co/ghyT4Ubk1r,"https://twitter.com/dog_rates/status/732005617171337216/photo/1,https://twitter.com/dog_rates/status/732005617171337216/photo/1",unknown,english_setter,https://pbs.twimg.com/media/CiibOMzUYAA9Mxz.jpg,4965,13954,1.1
731285275100512256,2016-05-14 00:49:30+00:00,iphone,This is Solomon. He's a Beneroo Cumberflop. 12/10 would hug passionately https://t.co/5phLAnGPTP,https://twitter.com/dog_rates/status/731285275100512256/photo/1,unknown,pembroke,https://pbs.twimg.com/media/CiYME3tVAAENz99.jpg,921,3290,1.2
730573383004487680,2016-05-12 01:40:42+00:00,iphone,This is Rooney. He can't comprehend glass. 10/10 it'll be ok pupper https://t.co/CnUl2uDBBV,"https://twitter.com/dog_rates/status/730573383004487680/photo/1,https://twitter.com/dog_rates/status/730573383004487680/photo/1,https://twitter.com/dog_rates/status/730573383004487680/photo/1",pupper,american_staffordshire_terrier,https://pbs.twimg.com/media/CiOEnI6WgAAmq4E.jpg,1960,4554,1.0
730427201120833536,2016-05-11 15:59:50+00:00,iphone,This is Crystal. She's flawless. Really wants to be a frat bro. 11/10 who does she even know here? https://t.co/WyqNFvEulG,https://twitter.com/dog_rates/status/730427201120833536/photo/1,unknown,eskimo_dog,https://pbs.twimg.com/media/CiL_qh0W0AAu5VA.jpg,960,3265,1.1
730211855403241472,2016-05-11 01:44:07+00:00,iphone,This is Ziva. She doesn't know how her collar works. 11/10 would totally fix for her https://t.co/K7pthJXjWE,https://twitter.com/dog_rates/status/730211855403241472/photo/1,unknown,pug,https://pbs.twimg.com/media/CiI7zVZUoAEzGW7.jpg,976,3563,1.1
729823566028484608,2016-05-10 00:01:12+00:00,iphone,This is Stefan. He's a downright remarkable pup. 13/10 https://t.co/Ebjt6Y4fMh,https://twitter.com/dog_rates/status/729823566028484608/photo/1,unknown,kelpie,https://pbs.twimg.com/media/CiDap8fWEAAC4iW.jpg,1151,3718,1.3
728760639972315136,2016-05-07 01:37:30+00:00,iphone,"When you're way too slow for the ""down low"" portion of a high five. 13/10 https://t.co/Cofwoy7Vpq","https://twitter.com/dog_rates/status/728760639972315136/photo/1,https://twitter.com/dog_rates/status/728760639972315136/photo/1",unknown,pembroke,https://pbs.twimg.com/media/Ch0T71OWMAA4yIw.jpg,1576,4369,1.3
728751179681943552,2016-05-07 00:59:55+00:00,iphone,This is Flurpson. He can't believe it's not butter. 10/10 https://t.co/XD3ort1PsE,https://twitter.com/dog_rates/status/728751179681943552/photo/1,unknown,saint_bernard,https://pbs.twimg.com/media/Ch0LVPdW0AEdHgU.jpg,627,2597,1.0
728387165835677696,2016-05-06 00:53:27+00:00,iphone,"This is Enchilada (yes, that's her real name). She's a Low-Cruisin Plopflopple. Very rare. Only a few left. 12/10 https://t.co/SiaiTWgsfP",https://twitter.com/dog_rates/status/728387165835677696/photo/1,unknown,collie,https://pbs.twimg.com/media/ChvAQuMWMAAVaKD.jpg,888,3481,1.2
728015554473250816,2016-05-05 00:16:48+00:00,iphone,This is Rueben. He has reached ultimate pupper zen state. 11/10 tranquil af https://t.co/Z167HgtnBi,https://twitter.com/dog_rates/status/728015554473250816/photo/1,pupper,cocker_spaniel,https://pbs.twimg.com/media/ChpuRyvVAAARMoq.jpg,1017,3871,1.1
727685679342333952,2016-05-04 02:26:00+00:00,iphone,This is Cilantro. She's a Fellation Gadzooks. Eyes are super magical af. 12/10 could get lost in https://t.co/yJ26LNuyj5,https://twitter.com/dog_rates/status/727685679342333952/photo/1,unknown,border_collie,https://pbs.twimg.com/media/ChlCQg-VIAQ_8g4.jpg,585,2791,1.2
727644517743104000,2016-05-03 23:42:26+00:00,iphone,Here's a doggo struggling to cope with the winds. 13/10 https://t.co/qv3aUwaouT,"https://twitter.com/dog_rates/status/727644517743104000/photo/1,https://twitter.com/dog_rates/status/727644517743104000/photo/1",doggo,great_pyrenees,https://pbs.twimg.com/media/Chkc1BQUoAAa96R.jpg,1621,5496,1.3
727175381690781696,2016-05-02 16:38:15+00:00,iphone,This is Karll. He just wants to go kayaking. 10/10 please someone take Karll kayaking already https://t.co/vXLkvyNQHp,"https://twitter.com/dog_rates/status/727175381690781696/photo/1,https://twitter.com/dog_rates/status/727175381690781696/photo/1",unknown,flat-coated_retriever,https://pbs.twimg.com/media/ChdyJvdWwAA5HGd.jpg,1270,3653,1.0
726828223124897792,2016-05-01 17:38:46+00:00,iphone,This is Bloop. He's a Phoenician Winnebago. Tongue is just wow. That box is all he has (tragic). 12/10 would caress https://t.co/DWNrPPXgHA,https://twitter.com/dog_rates/status/726828223124897792/photo/1,unknown,miniature_pinscher,https://pbs.twimg.com/media/ChY2aHyWMAAbNQE.jpg,934,3357,1.2
726224900189511680,2016-04-30 01:41:23+00:00,iphone,I'm getting super heckin frustrated with you all sending in non canines like this ostrich. We only rate dogs... 9/10 https://t.co/Rgbni2Ns8z,https://twitter.com/dog_rates/status/726224900189511680/photo/1,unknown,standard_poodle,https://pbs.twimg.com/media/ChQRsYaW0AETD7z.jpg,1059,4155,0.9
725786712245440512,2016-04-28 20:40:11+00:00,iphone,Say hello to Lillie. She's a Rutabagan Floofem. Poor pupper ate and then passed out. 11/10 relatable af https://t.co/uIdGqug9rw,https://twitter.com/dog_rates/status/725786712245440512/photo/1,pupper,chow,https://pbs.twimg.com/media/ChKDKmIWIAIJP_e.jpg,1268,3918,1.1
725729321944506368,2016-04-28 16:52:08+00:00,iphone,This is Lola. She's a Butternut Splishnsplash. They are known to be ferocious af. 12/10 would absolutely still pet https://t.co/adQt5a6TZU,https://twitter.com/dog_rates/status/725729321944506368/photo/1,unknown,boxer,https://pbs.twimg.com/media/ChJO9YaWYAEL0zC.jpg,1640,4876,1.2
724983749226668032,2016-04-26 15:29:30+00:00,iphone,This is Fred-Rick. He dabbles in parkour. The elevation gives him power. 12/10 hopefully visiting a mailbox near you https://t.co/qFqLtudIiD,https://twitter.com/dog_rates/status/724983749226668032/photo/1,unknown,golden_retriever,https://pbs.twimg.com/media/Cg-o3w0WgAANXdv.jpg,1193,3504,1.2
724405726123311104,2016-04-25 01:12:38+00:00,iphone,This is Ashleigh. She's having Coachella withdrawals. Didn't even go tho. 10/10 stay strong pupper https://t.co/nRUaKWnJfH,https://twitter.com/dog_rates/status/724405726123311104/photo/1,pupper,golden_retriever,https://pbs.twimg.com/media/Cg2bKLAWwAA0WEm.jpg,1543,4953,1.0
724049859469295616,2016-04-24 01:38:33+00:00,iphone,This is Kreggory. He just took a look at his student debt. 10/10 can't even comprehend it https://t.co/XTsZTgilnT,https://twitter.com/dog_rates/status/724049859469295616/photo/1,unknown,border_collie,https://pbs.twimg.com/media/CgxXf1TWYAEjY61.jpg,1652,4055,1.0
723912936180330496,2016-04-23 16:34:28+00:00,iphone,This is Sugar. She's a Bolivian Superfloof. Spherical af. 12/10 would never let go of https://t.co/AhMfUu6Onm,https://twitter.com/dog_rates/status/723912936180330496/photo/1,unknown,samoyed,https://pbs.twimg.com/media/Cgva-QqUUAA7Hv9.jpg,1149,3661,1.2
723673163800948736,2016-04-23 00:41:42+00:00,iphone,This is Ivar. She is a badass Viking warrior. Will sack your village. 10/10 savage af https://t.co/Dz6MiVssVU,https://twitter.com/dog_rates/status/723673163800948736/photo/1,unknown,golden_retriever,https://pbs.twimg.com/media/CgsA5eFWgAAu0qn.jpg,830,2840,1.0
722974582966214656,2016-04-21 02:25:47+00:00,iphone,Happy 4/20 from the squad! 13/10 for all https://t.co/eV1diwds8a,https://twitter.com/dog_rates/status/722974582966214656/photo/1,unknown,great_dane,https://pbs.twimg.com/media/CgiFjIpWgAA4wVp.jpg,1457,3845,0.2
722613351520608256,2016-04-20 02:30:23+00:00,iphone,Meet Schnitzel. He's a Tropicana Floofboop. Getting too big for his favorite basket. 12/10 just so damn fluffy https://t.co/qjd0UJKYUY,https://twitter.com/dog_rates/status/722613351520608256/photo/1,unknown,labrador_retriever,https://pbs.twimg.com/media/Cgc9AjMVIAERdUA.jpg,1521,4662,1.2
721503162398597120,2016-04-17 00:58:53+00:00,iphone,This is Panda. He's happy af. 11/10 https://t.co/IOAk9i4UvE,"https://twitter.com/dog_rates/status/721503162398597120/photo/1,https://twitter.com/dog_rates/status/721503162398597120/photo/1,https://twitter.com/dog_rates/status/721503162398597120/photo/1,https://twitter.com/dog_rates/status/721503162398597120/photo/1",unknown,pomeranian,https://pbs.twimg.com/media/CgNLS1PW8AAxWSN.jpg,1675,4315,1.1
721001180231503872,2016-04-15 15:44:11+00:00,iphone,This is Oliver. Bath time is upon him. His fear of the wetness postpones his ultimate pupper destiny. 11/10 https://t.co/AFzzKqR4tT,https://twitter.com/dog_rates/status/721001180231503872/photo/1,pupper,samoyed,https://pbs.twimg.com/media/CgGCvxAUkAAx55r.jpg,566,2384,1.1
720775346191278080,2016-04-15 00:46:48+00:00,iphone,This is Berkeley. He's in a predicament. 10/10 someone help him https://t.co/XSEXdQupej,https://twitter.com/dog_rates/status/720775346191278080/photo/1,unknown,newfoundland,https://pbs.twimg.com/media/CgC1WqMW4AI1_N0.jpg,597,2302,1.0
720415127506415616,2016-04-14 00:55:25+00:00,iphone,Garden's coming in nice this year. 10/10 https://t.co/5Lra3e4rrw,"https://twitter.com/dog_rates/status/720415127506415616/photo/1,https://twitter.com/dog_rates/status/720415127506415616/photo/1,https://twitter.com/dog_rates/status/720415127506415616/photo/1",unknown,rottweiler,https://pbs.twimg.com/media/Cf9tuHUWsAAHSrV.jpg,1392,3875,1.0
720389942216527872,2016-04-13 23:15:21+00:00,iphone,This is RalphÃ©. He patrols the lake. Looking for babes. 11/10 https://t.co/Pb6iMmo0wk,https://twitter.com/dog_rates/status/720389942216527872/photo/1,unknown,pembroke,https://pbs.twimg.com/media/Cf9W1J-UMAErahM.jpg,2307,5971,1.1
719991154352222208,2016-04-12 20:50:42+00:00,iphone,This doggo was initially thrilled when she saw the happy cartoon pup but quickly realized she'd been deceived. 10/10 https://t.co/mvnBGaWULV,"https://twitter.com/dog_rates/status/719991154352222208/photo/1,https://twitter.com/dog_rates/status/719991154352222208/photo/1",doggo,golden_retriever,https://pbs.twimg.com/media/Cf3sH62VAAA-LiP.jpg,1615,4557,1.0
719551379208073216,2016-04-11 15:43:12+00:00,iphone,This is Harnold. He accidentally opened the front facing camera. 10/10 get it together Harnold https://t.co/S6JHaSMtln,https://twitter.com/dog_rates/status/719551379208073216/photo/1,unknown,malamute,https://pbs.twimg.com/media/CfxcKU6W8AE-wEx.jpg,1756,4731,1.0
719332531645071360,2016-04-11 01:13:34+00:00,iphone,This is Pippa. She managed to start the car but is waiting for you to buckle up before driving. Responsible af 11/10 https://t.co/htrlmC7saz,https://twitter.com/dog_rates/status/719332531645071360/photo/1,unknown,dandie_dinmont,https://pbs.twimg.com/media/CfuVGl3WEAEKb16.jpg,881,3234,1.1
718971898235854848,2016-04-10 01:20:33+00:00,iphone,This is Sadie. She is prepared for battle. 10/10 https://t.co/JRckDkZVRT,https://twitter.com/dog_rates/status/718971898235854848/photo/1,unknown,golden_retriever,https://pbs.twimg.com/media/CfpNGTHUIAAA8XC.jpg,1002,3263,1.0
718939241951195136,2016-04-09 23:10:47+00:00,iphone,This is Otis. Everybody look at Otis. 12/10 would probably faint while petting https://t.co/I9qoe1uEih,https://twitter.com/dog_rates/status/718939241951195136/photo/1,unknown,pembroke,https://pbs.twimg.com/media/CfovbK4WIAAkTn3.jpg,1619,4904,1.2
718631497683582976,2016-04-09 02:47:55+00:00,iphone,We normally don't rate marshmallows but this one appears to be flawlessly toasted so I'll make an exception. 10/10 https://t.co/D9jbbmPmos,https://twitter.com/dog_rates/status/718631497683582976/photo/1,unknown,pomeranian,https://pbs.twimg.com/media/CfkXiX6W4AAmICF.jpg,7390,17687,1.0
718246886998687744,2016-04-08 01:19:36+00:00,iphone,This is Alexanderson. He's got a weird ass birth mark. Dreadful at fetch. Won't eat kibble. 3/10 wtf @Target https://t.co/FmxOpf2Sgl,https://twitter.com/dog_rates/status/718246886998687744/photo/1,unknown,chihuahua,https://pbs.twimg.com/media/Cfe5tLWXEAIaoFO.jpg,458,1795,0.3
718234618122661888,2016-04-08 00:30:51+00:00,iphone,This is Suki. She was born with a blurry tail (unfortunate). Next level tongue tho. 11/10 nifty hardwood https://t.co/05S8oYztgb,https://twitter.com/dog_rates/status/718234618122661888/photo/1,unknown,malamute,https://pbs.twimg.com/media/CfeukpmW4AEGjOE.jpg,927,3634,1.1
717841801130979328,2016-04-06 22:29:56+00:00,iphone,This is Barclay. His father was a banana. 11/10 appeeling af https://t.co/ucOEfr2rjV,https://twitter.com/dog_rates/status/717841801130979328/photo/1,unknown,brittany_spaniel,https://pbs.twimg.com/media/CfZJTphWAAAl5Ys.jpg,556,2310,1.1
717421804990701568,2016-04-05 18:41:02+00:00,iphone,This is Ebby. She's a Zimbabwean Feta. Embarrassed by ridiculously squishy face. 9/10 would squeeze softly https://t.co/LBJqxMGaHi,"https://twitter.com/dog_rates/status/717421804990701568/photo/1,https://twitter.com/dog_rates/status/717421804990701568/photo/1",unknown,miniature_pinscher,https://pbs.twimg.com/media/CfTLUYWXEAEkyES.jpg,773,2937,0.9
717047459982213120,2016-04-04 17:53:31+00:00,iphone,This is FlÃ¡vio (pronounced Baxter). He's a Benesnoop Cumberdog. Super rare. Symmetrical. 12/10 would pet so well https://t.co/fGgleFiBPq,https://twitter.com/dog_rates/status/717047459982213120/photo/1,unknown,golden_retriever,https://pbs.twimg.com/media/CfN23ArXEAEkZkz.jpg,1772,5897,1.2
716802964044845056,2016-04-04 01:41:58+00:00,iphone,This is Link. He struggles with couches. 10/10 would assist https://t.co/SbX4e6Yg3o,"https://twitter.com/dog_rates/status/716802964044845056/photo/1,https://twitter.com/dog_rates/status/716802964044845056/photo/1",unknown,malinois,https://pbs.twimg.com/media/CfKYfeBXIAAopp2.jpg,1077,4036,1.0
716791146589110272,2016-04-04 00:55:01+00:00,iphone,Meet Jennifur. She's supposed to be navigating. Not even buckled up. Insubordinate &amp; churlish. 11/10 would still pet https://t.co/h0trcJohYO,https://twitter.com/dog_rates/status/716791146589110272/photo/1,unknown,pomeranian,https://pbs.twimg.com/media/CfKNvU8WsAAvI9Z.jpg,1471,7776,1.1
716285507865542656,2016-04-02 15:25:47+00:00,iphone,This is Stephanus. She stays woke. 12/10 https://t.co/WIWabMngQZ,"https://twitter.com/dog_rates/status/716285507865542656/photo/1,https://twitter.com/dog_rates/status/716285507865542656/photo/1",unknown,yorkshire_terrier,https://pbs.twimg.com/media/CfDB3aJXEAAEZNv.jpg,979,2608,1.2
716080869887381504,2016-04-02 01:52:38+00:00,iphone,Here's a super majestic doggo and a sunset 11/10 https://t.co/UACnoyi8zu,"https://twitter.com/dog_rates/status/716080869887381504/photo/1,https://twitter.com/dog_rates/status/716080869887381504/photo/1",doggo,golden_retriever,https://pbs.twimg.com/media/CfAHv83UMAIEQYx.jpg,1750,6368,1.1
715928423106027520,2016-04-01 15:46:52+00:00,iphone,This is Bubbles. He's a Yorkshire Piccolope. 11/10 would snug aggressively https://t.co/3BhMojONxq,https://twitter.com/dog_rates/status/715928423106027520/photo/1,unknown,pug,https://pbs.twimg.com/media/Ce99GhLW8AAHG38.jpg,811,2991,1.1
715733265223708672,2016-04-01 02:51:22+00:00,iphone,This is a taco. We only rate dogs. Please only send in dogs. Dogs are what we rate. Not tacos. Thank you... 10/10 https://t.co/cxl6xGY8B9,https://twitter.com/dog_rates/status/715733265223708672/photo/1,unknown,dandie_dinmont,https://pbs.twimg.com/media/Ce7LlUeUUAEQkQl.jpg,1562,4384,1.0
715696743237730304,2016-04-01 00:26:15+00:00,iphone,Meet Toby. He's a Lithuanian High-Steppin Stickeroo. One of the more accomplished Stickeroos around. 10/10 so nifty https://t.co/cYPHuJYTjC,https://twitter.com/dog_rates/status/715696743237730304/photo/1,unknown,staffordshire_bullterrier,https://pbs.twimg.com/media/Ce6qZC2WAAAcSoI.jpg,1192,3679,1.0
715200624753819648,2016-03-30 15:34:51+00:00,iphone,This is Michelangelope. He's half coffee cup. Rare af. 12/10 would hug until someone stopped me https://t.co/tvVDY0G911,https://twitter.com/dog_rates/status/715200624753819648/photo/1,unknown,chihuahua,https://pbs.twimg.com/media/CeznK6IWEAEFUPq.jpg,1733,4846,1.2
714957620017307648,2016-03-29 23:29:14+00:00,iphone,This is Curtis. He's an Albino Haberdasher. Terrified of dandelions. They really spook him up. 10/10 it'll be ok pup https://t.co/s8YcfZrWhK,https://twitter.com/dog_rates/status/714957620017307648/photo/1,unknown,great_pyrenees,https://pbs.twimg.com/media/CewKKiOWwAIe3pR.jpg,1302,3889,1.0
714606013974974464,2016-03-29 00:12:05+00:00,iphone,Here are two lil cuddly puppers. Both 12/10 would snug like so much https://t.co/zO4eb7C4tG,https://twitter.com/dog_rates/status/714606013974974464/photo/1,unknown,norfolk_terrier,https://pbs.twimg.com/media/CerKYG8WAAM1aE-.jpg,854,3412,1.2
714214115368108032,2016-03-27 22:14:49+00:00,iphone,Happy Easter from the squad! ðŸ‡ðŸ¶ 13/10 for all https://t.co/YMx4KWJUAB,https://twitter.com/dog_rates/status/714214115368108032/photo/1,unknown,pug,https://pbs.twimg.com/media/Cell8ikWIAACCJ-.jpg,812,2149,1.3
714141408463036416,2016-03-27 17:25:54+00:00,iphone,"I know we only rate dogs, but since it's Easter I guess we could rate a bunny for a change. 10/10 petable as hell https://t.co/O2RlKXigHu",https://twitter.com/dog_rates/status/714141408463036416/photo/1,unknown,labrador_retriever,https://pbs.twimg.com/media/Cekj0qwXEAAHcS6.jpg,1308,4068,1.0
713919462244790272,2016-03-27 02:43:58+00:00,iphone,This is Kanu. He's a Freckled Ticonderoga. Simply flawless. 12/10 would perform an elaborate heist to capture https://t.co/7vyAzIURrE,https://twitter.com/dog_rates/status/713919462244790272/photo/1,unknown,siberian_husky,https://pbs.twimg.com/media/CehZ9mLWsAAsn28.jpg,736,3097,1.2
713761197720473600,2016-03-26 16:15:05+00:00,iphone,This is Piper. She would really like that tennis ball core. Super sneaky tongue slip. 12/10 precious af https://t.co/QP6GHi5az9,"https://twitter.com/dog_rates/status/713761197720473600/photo/1,https://twitter.com/dog_rates/status/713761197720473600/photo/1",unknown,brittany_spaniel,https://pbs.twimg.com/media/CefKBOuWIAAIlKD.jpg,1261,4555,1.2
713177543487135744,2016-03-25 01:35:51+00:00,iphone,This is Lance. Lance doesn't give a shit. 10/10 we should all be more like Lance https://t.co/SqnG9Ap28J,https://twitter.com/dog_rates/status/713177543487135744/photo/1,unknown,whippet,https://pbs.twimg.com/media/CeW3MWMWQAEOMbq.jpg,2650,6777,1.0
712809025985978368,2016-03-24 01:11:29+00:00,iphone,This is Stubert. He just arrived. 10/10 https://t.co/HVGs5aAKAn,https://twitter.com/dog_rates/status/712809025985978368/photo/1,unknown,labrador_retriever,https://pbs.twimg.com/media/CeRoBaxWEAABi0X.jpg,6205,17882,1.0
712668654853337088,2016-03-23 15:53:42+00:00,iphone,Say hello to Sunny and Roxy. They pull things out of water together. 10/10 for both https://t.co/88aedAmxcl,"https://twitter.com/dog_rates/status/712668654853337088/photo/1,https://twitter.com/dog_rates/status/712668654853337088/photo/1,https://twitter.com/dog_rates/status/712668654853337088/photo/1",unknown,labrador_retriever,https://pbs.twimg.com/media/CePoVTyWsAQEz1g.jpg,1122,3896,1.0
712097430750289920,2016-03-22 02:03:52+00:00,iphone,I can't even comprehend how confused this dog must be right now. 10/10 https://t.co/8AGcQ4hIfK,https://twitter.com/dog_rates/status/712097430750289920/photo/1,unknown,labrador_retriever,https://pbs.twimg.com/media/CeHg1klW8AE4YOB.jpg,959,3546,1.0
